,id,country,province,winery,variety,points,description
74466,93565,US,California,Riverbench,Chardonnay,90,familiar tasty grape aromas caramel buttercream vanilla smoke brown spices squeezed lemons salt lemon lime palate straightforward quite clean crisp
195478,214577,Israel,Galilee,Carmel,Merlot,89,opens aromas plum boysenberry accented licorice root menthol fruity core continues shine smooth round palate alongside accents purple violet driven spice linger close
171175,140274,US,California,Landmark,Pinot Noir,94,sweet smell campfire meets bacon dried purple flowers licorice espresso razor edge delicious palate raspberry fruits dried strawberry mocha minty sensation lingers amidst noticeable tannic grip
76650,95749,Spain,Levante,Juan Gil,Red Blend,89,touch minty herbal chocolate creamy richness hugely flavorful rumbles bold berry smoky dryness stops chocolate coffee pepper always jumilla better wines assuming like extracted modern style
4091,254091,US,California,Prime,Chardonnay,89,shows chablis like steely minerally dryness subtle lemons limes grapefruits marked firm acids elegant great structure integrity meant drinking
139611,108710,US,Oregon,Shea,Pinot Noir,92,varied fruits—citrus apple raspberry cherry—accompany tannic breakfast astringent side dollop nougat almond paste adding highlights
218749,237848,France,Bordeaux,Château Palmer,Bordeaux-style Red Blend,94,barrel sample higher proportion merlot usual palmer goes lovely fresh soft fruits touch spice juicy berries finally getting depth dusty chewy
251683,20782,US,California,Kastania,Pinot Noir,86,pinot lovely silky mouthfeel strawberries tough marked acids green distract
246461,15560,US,California,Wayfarer,Chardonnay,94,estate grown white wayfarer vineyard fort ross seaview coast stunning culled several distinct blocks planted handful clones including eden wente aromas orange blossom peach body expansive flinty succulent offers layered complexity making enjoyable
164985,134084,US,California,Crossbarn by Paul Hobbs,Pinot Noir,89,dark brooding savory mushroom yumminess paul hobbs affordable pinot noir offers dark cherry spice proportion concentrated lush perfumed accompany range foods enjoyably
43628,62727,France,Burgundy,Albert Morot,Pinot Noir,87,firm extract brings licorice cover difficult soften
1579,251579,France,Burgundy,Maison Jessiaume,Chardonnay,94,tight young brings intense vintage hiding power potential moment offering concentrated develop slowly befits grand status
232859,1958,US,California,Stephanie,Merlot,88,dense blackberry cherry mocha spice contains cabernet sauvignon lends weight body technically sweetness comes ripeness caramel sugary bacony taste delicious
19221,269221,US,California,Bighorn,Cabernet Sauvignon,83,marked excessive alcohol clumsy cabernet deficient lively worn cherry mocha
152861,121960,Italy,Tuscany,Buondonno,Red Blend,90,savory selection offers earthy aromas underbrush truffle leather zesty palate expresses tart cherry punctuated mint vanilla espresso accents balanced firm ample freshness artisan wines downey selection
191790,210889,US,Washington,Sparkman,Bordeaux-style Red Blend,88,stella three fifths cabernet sauvignon petit verdot merlot main components aged french taransaud barrels delicious toasty overpower light watermelon strawberry
81018,150117,US,California,Aquinas,Merlot,86,fruity blackberries cherries additional umami richness tangy bacon spices hardly notice texture rustic solid drinking
267541,36640,New Zealand,Martinborough,Escarpment,Pinot Noir,91,delicate owner winemaker larry mckenna describes pahi seems smoky vaguely herbal hinting tomato offers cherry soft gentle like turn silky now–
198486,217585,Italy,Piedmont,Giacomo Vico,Chardonnay,90,creamy chardonnay embroidery floral toasted aromas peach apricot followed vanilla seed toasted almond texture smooth silky stand dishes béchamel sauce melted cheese
167689,136788,US,Oregon,Panther Creek,Pinot Noir,88,blend ponte schindler kalita smooth supple though falling flat terms mouthfeel leafy herbal components soonest followed sweet barrel months half french
79657,98756,France,Bordeaux,Château le Paradis,Bordeaux-style Red Blend,88,solid effort dark texture stage firmly edged currant fruits soften always firm side
53483,72582,US,California,Stags' Leap Winery,Red Blend,89,blend features merlot petite sirah cabernet sauvignon malbec combining brawn beauty light grip wrap around softly textured body making approachable easygoing experience
70679,89778,Germany,Mosel,Thanisch,Riesling,89,ripened mango pineapple lend lavish tropical feel riesling resolute core balance grace concentrated fruity maintains vitality length
18031,268031,France,Bordeaux,Château Cantinot,Bordeaux-style Red Blend,87,fruited wood element support berry cranberry element firm freshness ready
49501,68600,South Africa,Simonsberg-Stellenbosch,Morgenhof,Cabernet Sauvignon,90,name like mint definitely gorgeous fresh eucalyptus center stage blackberry boysenberry backbone menthol continues mouth gripping structured tastes like thin mint crumbles
222102,241201,New Zealand,Marlborough,Drylands,Pinot Noir,86,fairly priced entry level zealand pinot offers herbal cherry aromas simple fruity finishes clean crisp acids imported icon estates
24935,274935,Germany,Rheingau,Domdechant Werner,Riesling,90,shows bright vibrant character vintage marrying zesty lime minerals sweet pineapple green apple fresh clean mouthwatering leaves wanting another
279338,48437,France,Loire Valley,Joseph Mellot,Pinot Noir,88,fruity full cherry plum wood aging crisp fill lightly tannic texture
131662,100761,Italy,Northwestern Italy,Les Crêtes,Chardonnay,88,balanced bright chardonnay cool climate region northern italy shows crisp aromas peach citrus followed light shadings spice bitter almond silky smooth citrus close
213687,232786,Chile,Colchagua Costa,Koyle,Sauvignon Blanc,89,snappy front palate green bell pepper tangerine grass aromas feels alert crisp citric lime grapefruit pole bean culminate lemon persistent grapefruit linear high style sauvignon blanc definite coastal influences
157224,126323,US,California,Tiedemann,Red Blend,87,aged months french made predominantly tempranillo simple rendering cherry leather tannin weight
156718,125817,US,California,Four Cairn,Syrah,85,nowhere near overripe pruny taste heat plus side hard developing
32463,51562,France,Rhône Valley,M. Chapoutier,Syrah,90,chapoutier largest hermitage cuvée almost fudge like sweet confected sweaty leather dried cherries chocolate framed silky now–
271729,40828,New Zealand,Marlborough,Clos Henri,Pinot Noir,90,loire valley bourgeois family firmly built region known open knit accessibility sturdy beet cherry destined last framed firm
72179,91278,France,France Other,François Lurton,Sauvignon Blanc,85,fresh herbaceous sauvignon blanc mainly french south west lively crisp totally fruity character grapefruit gooseberry tropical
194242,213341,US,California,V. Sattui,Pinot Noir,88,bottle tight airing coaxes plenty cherry currant tart persimmon mouthfeel decanter breathe mellow
114105,183204,US,Washington,Columbia Winery,Chardonnay,87,part ascentia portfolio columbia seems righting fresh creamy chardonnay wide variety pastas poultry dishes lacy stone fruits light tropical streak vanilla running
177092,146191,Germany,Mosel,Joh. Jos. Prüm,Riesling,90,pale lemony color initial reductive blow reveal classic mosel delicate flowers white stone slate crisp elegant juicy packed mouthwatering stone citrus minerally taut focused tremendous length persistent juicy
235874,4973,US,California,Sean Thackrey,Pinot Noir,90,depth cherry sean thackrey wentzel clone shows concentration weight riper fleshier bolder character clonal companions grown vineyard block
256960,26059,France,Bordeaux,Château Ad Francos,Bordeaux-style Red Blend,84,leaves jammy character merlot sweetness dominates seems unbalanced maybe result recent bottling
59920,79019,US,California,Donkey & Goat,Syrah,86,tart lean welcoming earthy lively aromas sour cherry tart raspberry personality severe sharp tastes light alcohol high hurry mellowness maturity develop
231202,301,US,Washington,Buried Cane,Chardonnay,87,clean tart lightly spicy stainless style cool climate accent lime lemon keeps alcohol makes fine match shellfish white fish light pasta dishes
256385,25484,Bulgaria,Thracian Valley,Domaine Boyar,Merlot,89,aromas mint talcum powder dried cherry lead delightful palate plums raspberries soft persistent notable bulgarian merlot
223835,242934,US,California,Dog Tail,Chardonnay,86,great price chard quality crisp amply flavored peaches cream tangerines buttered toast richness costly wines
157804,126903,US,California,C.G. di Arie,Sauvignon Blanc,86,zippy sierra foothills pleasing grapefruit coating minerals length lift
171280,140379,France,Loire Valley,Bernier,Chardonnay,84,soft tank aged attractive apple fruits touch citrus crisp light fruity ready
226910,246009,Chile,Curicó Valley,Aresti,Chardonnay,84,sweet welcoming almond pear citrus blossom palate sweet side slightly sugary pear cantaloupe medium intensity ample body weight textbook style midlevel chilean chardonnay plump candied monotone approach
22489,272489,US,California,Dynamite Vineyards,Zinfandel,88,bone slightly overripe dusty briary aromas raisins bitter dark chocolate plums serious plenty sophistication
105216,174315,US,California,Glasshaus,Pinot Noir,90,muddled first comes around reveal strong floral component rose water geranium staying light fresh palate subtle flavorful finishes earthy asian spice
56134,75233,US,California,ONX,Red Blend,88,lusty packed wildly delicious structural balance lift elegance blended grenache tempranillo cabernet sauvignon syrah floods mouth blackberries currants chocolate bacon sweet taste brandied ready
121281,190380,US,California,Beringer,Chardonnay,89,criticism excessive case sweet char smoky vanilla brûléed butterscotch completely dominate beringer chards montrachet simply shoulder burden wood said elegant devotees love
223466,242565,US,California,Lolonis,Zinfandel,83,problematic starts inert mainly caramelized wood mouth sweet simple cola blackberry pepper cocoa bitterness
278093,47192,US,California,Sobon Estate,Zinfandel,90,power flows full bodied making focused delicious firm coating tannin kicks weight texture help linger plum smoke pepper among complex made vines planted nearly foot elevation
238416,7515,US,California,D.R. Stephens,Cabernet Sauvignon,92,varietal reflective vintage provenance celebration pepper blackberry around intensely full bodied bittersweet palate tobacco leaf leather saddle interweave middle
280654,49753,Italy,Central Italy,Fongoli,Red Blend,88,aromas suggest tilled soil mature blackberry leather game allspice lively palate offers prune cherries marinated spirits ground pepper licorice alongside firmly tannic backbone brisk
249070,18169,Italy,Tuscany,Cecchi,Red Blend,90,aromas underbrush wild flower leather berry lead juicy palate offers cherry cinnamon anise game alongside fresh velvety
115933,185032,Australia,South Australia,Penley Estate,Chardonnay,86,slightly heavyhanded throwback style chardonnay copious buttered popcorn weighty viscous mouthfeel crispness provide sense balance
101075,170174,US,California,Tudor Wines,Pinot Noir,90,smelling like pastry shop offers currant warm brioche scents recall raspberry tarts freshly baked breads made cousins christian tudor whose family made wines thousands croatia grown table grapes since california body fairly light delivering tart raspberry decent makes mouth water
82405,151504,US,Virginia,Tarara,Syrah,86,initially sweet feminine violet juicy blueberries palate innocent coquettish full body chunky vibrant backdrop smoke char compelling pick potentially benefit cellar
107408,176507,US,California,Costa de Oro,Chardonnay,88,chardonnay oozes showy pineapples pears golden mangoes winemaking buttered toast crème brûlée taste yeast particularly subtle projecting power instead
27807,277807,Italy,Tuscany,Tenimenti Angelini,Red Blend,83,maybe producer flight brunello stick angelini value priced blend merlot sangiovese canaiolo strong green element taken tomatoey edges adequate raspberry cherry elevate things
204358,223457,Chile,Bío Bío Valley,Viña el Aromo,Pinot Noir,84,citric cherry bland earthy palate inoffensive feel sweet cherry vanilla sweetness carries onto candied generally decent highly regular
249834,18933,Italy,Sicily & Sardinia,Barone di Villagrande,Red Blend,91,merlot nerello mascalese perfect blending partners creating cherry softness bright intensity plus volcanic minerality elegance polished clean
194836,213935,US,California,Indigené,Riesling,84,sweet style simple sugary peach pear vanilla honeysuckle
83349,152448,US,Washington,Gorman,Red Blend,92,exceptionally beautifully proportioned gravelly base bright currant raspberry tight tart initially opens lush superripe finishes hard green bright intense baking spice highlights
215542,234641,Chile,Maipo Valley,Santa Ema,Cabernet Sauvignon,84,rubber earth aromas lead berry scents pinch vinegar firm mouth cranberry herbal raspberry shows tart basic mildly herbal
227172,246271,US,Washington,Columbia Winery,Cabernet Sauvignon,83,feels awkward mouth quite connect light strawberry watermelon—odd cabernet—and palate drops thin hard softness makes quaffable generic
21685,271685,Australia,Victoria,Mount Langi Ghiran,Riesling,89,citrus chalk dust pear riesling main components palate compelling though spare delicate style finishes dusty gumdrop imported epic wines
50630,69729,US,California,Comartin,Syrah,89,suave blueberry chocolate meet light delicate violet florality single vineyard bottling area based producer palate lively tart underripe blackberries sesame sizzling
103804,172903,Australia,Australia Other,Yellow Tail,Chardonnay,87,round lush boldly oaky caramelized nuts vanilla accenting tropical
75244,94343,US,Virginia,Breaux,Cabernet Sauvignon,85,broad scent defines cabernet sauvignon muffled blueberry toast cheese rind palate marked strapping upperlip bearing toast coffee bean
85907,155006,Australia,South Australia,Mesh,Riesling,88,unlike brethren eden valley riesling relies weight texture fine impression region lime sherbet stones plump palate lean wiry making approachable youth
13104,263104,US,California,Vina Robles,Sauvignon Blanc,90,fine sauvignon blanc crisp lemons limes figs vanilla honeysuckle tangy streak lemongrass applied richness lees shows buttercream
27012,277012,Spain,Catalonia,Mas Marçal,Red Blend,86,bulky raspberry punch like aromas like sweet like kirsch sugar beets coulis clearly reflects vintage soft chewy bent sweetness ager
27889,277889,US,California,Cambria,Chardonnay,91,winning offers aromas créme brulée smoked bacon pears peaches toasty vanilla keep coming stylish full palate shows similar mouthfeel continues long slightly sweet toasty smoky strong already better months maker fine affordable widely available katherine vineyard chardonnay value
122966,192065,US,Washington,Glen Fiona,Syrah,87,best glen fiona current releases displays cool climate varietal character mountain berry herb spice streak licorice
3212,253212,Italy,Tuscany,Casa di Terra,Red Blend,89,despite young bright blend syrah merlot cabernet sauvignon shows impressive sophistication personality neutral used fine tune spice aromas shows intense blackberry cherry leather pipe tobacco
10572,260572,US,California,Regan,Red Blend,82,dull soft somewhat vegetal tastes like brussel sprouts soaked squeeze sweet merlot cabernet
83824,152923,US,California,Stromberg Vineyards,Sauvignon Blanc,89,walk find varietal sauvignon blanc—it steal shows creek valley reputation variety long crisp unoaked richly honeyed offers waves mouth flattering citrus tropical green apple white peach pear production cases
3507,253507,US,Washington,Watermill,Syrah,90,syrah vineyards stone valley collines piano bring brambly berry retaining herbal peppery streaks coffee fresh turned earth excellent definition balance
191282,210381,US,Washington,Januik,Cabernet Sauvignon,92,stiff tannic bold cherry characteristic champoux vineyard veined iron gravel plus clover complex riveting peppery bite
76365,95464,US,California,MacPhail,Pinot Noir,93,herbal mint strawberry counterbalance density tannin foundation hails handful marquee vineyard sites including mardikian estate producer vineyard designates gate integrated tightrope spicy tease blueberry cedar
50539,69638,US,California,Au Bon Climat,Pinot Noir,89,bottling clendenen subtlety currants tiny bits strawberry iron showing rusty cherry character shows sipped chaparral pencil lead emerging requires attention rewards focus patience
181840,200939,US,Oregon,Soléna,Pinot Noir,89,appealing forest floor aromas waft glass leading tart spicy earthy balanced fruits white pepper bark graphite modest scale beautifully balanced perfect near term enjoyment
225558,244657,France,Rhône Valley,Marc Sorrel,Syrah,90,light style vintage wonderfully intricate spice complexity wrapped around leather creamy mouthfeel sense delicacy often found hermitage
150092,119191,US,Washington,Perimeter,Riesling,84,medium sweet offering aromas lime leaf jasmine lead apricot floral complexity offers drinking enjoyment
66965,86064,US,Washington,Le Chateau,Cabernet Sauvignon,90,bursting sweet cherry scents sensuous broad palate appeal washington merlots medium grained persistent toasty trail mocha
242211,11310,France,Bordeaux,Château Ségonzac,Bordeaux-style Red Blend,87,structured firm masking concentrated firm dense develop wait
253016,22115,France,Bordeaux,Château Ambe Tour Pourret,Bordeaux-style Red Blend,91,packed balanced dense tannic underlay judicious wood aging structure several
105941,175040,Portugal,Península de Setúbal,Bacalhôa Wines of Portugal,Syrah,89,step vintage smooth perfumed soft balancing layer wood spice ebullient berry fruits
190274,209373,Chile,Colchagua Valley,Maquis,Red Blend,86,powerful start hard rocks mouth loaded brim dense sweet plum berry bowl sooth wavers ultrafruity lusty rough rugged blend four bordeaux grapes plus syrah
242068,11167,Argentina,Mendoza Province,Bodegas Escorihuela,Syrah,84,mocha chocolate welcome taste generic spice leather seems acidified razor edge overly generous mouthfeel sheering
279750,48849,US,Oregon,Bryn Mawr Vineyards,Chardonnay,90,barrel fermented half half neutral tasty offers crisp highlights lemon orange peel substantial apple kiwi pear appealing touch crème brûlée comes makes graceful exit
224168,243267,US,California,Livingston Moffett,Cabernet Sauvignon,94,pulled best birthday result spectacular dense concentrated enormously complex cassis currant cherry cedar shows dryness firm fine young cabernet predict lifetime ahead resolve develop slowly another eight least
182602,201701,Spain,Northern Spain,Vega Sindoa,Merlot,84,navarran merlot often leans toward vegetal bell pepper tomato balancing plum cherry raspberry palate touch sheer scratchy green effort means herbaceous
10123,260123,US,Washington,Covey Run,Merlot,84,long past january release dark chewy tannic merlot tough unyielding blend includes malbec quite peppery herb actual simple dark
83152,152251,US,California,Rodney Strong,Cabernet Sauvignon,90,fruity soft flamboyant cabernet packed plum blackberry currant licorice dark chocolate spicy delicious savory probably showing best
224060,243159,US,California,Gary Farrell,Pinot Noir,95,amazing pale translucent ruby color waves cherries raspberries roasted hazelnuts cola pomegranates herb dusty asian spices smoky change constantly glass breathes endlessly fascinates bone tartly crisp develop bottle complexities eight
174091,143190,US,California,Lava Cap,Red Blend,86,blend cabernet franc syrah merlot zinfandel tempranillo carries deep cassis stewy leather around full bodied satisfying definitely present marked lingering cola like spice
83693,152792,US,Washington,Airfield Estates,Pinot Noir,88,soft entry beginning secondary bakery pastries mulberry prune soft spicy pleasing accessible finishes lick cinnamon already drinking
46333,65432,Chile,Rapel Valley,Lapostolle,Cabernet Sauvignon,86,heavy baked aromas plum berry rubber dense chunky grabby tannic feel grapey blackberry earthy tobacco minty round soft plump grabby
167652,136751,US,California,Foley,Pinot Noir,87,reserved aromas first shows charred wood cherries pomegranate graphite quite intriguing texturally palate sticky light body offering cola tart cranberry
26529,276529,France,Rhône Valley,Cave de Tain,Syrah,88,cave tain hermitage cooperative members biggest owner hermitage certainly able produce dense dusty tannic fine fruits dark seems developing fast last
81962,151061,Chile,Colchagua Valley,Siegel,Syrah,87,lemony tight start aromas roasted berry coffee shoe polish hard dark mouth fresh tannic forward herbs dark chocolate toast shows heat burn concentrated full force
4712,254712,US,California,Tudal,Cabernet Sauvignon,86,rough around edges county cabernet shows plenty varietal character full bodied tannic blackberry currant
29836,279836,US,California,Coastal Ridge,Chardonnay,85,anything remotely resembling true chardonnay price rare succeeds elemental level proper apple peach requisite amount vanilla tinged probably french barrels tiny sweet people like clean makes great value chardonnay
87732,156831,France,Champagne,Pascal Doquet,Chardonnay,92,smooth creamy champagne delicious peach apricot fruits linked harmonious whole great apple skin texture bite shape aftertaste
56103,75202,US,Oregon,Patton Valley,Pinot Noir,87,lorna marie winery reserve level bottling gets vintage seems thin almost watery hours breathing gains palate traction made look reserve level heft
83729,152828,France,Burgundy,Louis Latour,Pinot Noir,90,voluptuous edge generous strawberry plum juice final extreme freshness shows layer firm aging
43650,62749,US,California,Sharabella Wines,Pinot Noir,85,label says california grapes clarksburg near lodi pinot noir leave desired mostly aromas fairly simple oaky saying pinot noir specifically
184342,203441,US,California,Markham,Merlot,86,juicy merlot tannic brimming cherries currants oaky charred caramelized wood sticking soon
193791,212890,US,California,Trentadue,Merlot,83,streak stream medicinal cherry merlot life saver candy taste sweet
232905,2004,US,Oregon,Wine by Joe,Pinot Noir,84,underripe seems sour anything bitter stemmy creep
127232,196331,France,Burgundy,Domaine Faiveley,Pinot Noir,90,stunning perfume archetypal pinot noir soft gevrey fruits pure giving character firm sensuous long term aging worth keeping
99587,168686,Italy,Tuscany,Tenuta San Guido,Red Blend,90,makers italy legendary sassicaia cabernet sauvignon sangiovese blend delivers sweet cherry aromas backed vanilla tobacco shown great improvement produced
188544,207643,US,Washington,Mark Ryan,Syrah,92,better syrah vineyard mark ryan mcneilly peppery washed caramel bath long despite barrel influence grapes muscle texture stand equally
268073,37172,Spain,Levante,Monterebro,Syrah,91,blackberry cassis dusty aromas full bodied syrah monastrell great start staunch built firm dark masculine blackberry currant pepper salt gutsy powerful balanced impressive price
59330,78429,US,Washington,San Juan Vineyards,Cabernet Sauvignon,90,cabernet sauvignon pushing alcohol descend pruneville super slightly sweet open luscious slightly candied cherry chocolate covered strawberries mind acids support barrel keep lively inviting
131171,100270,US,California,Bell,Cabernet Sauvignon,93,georges vineyard heart appellation clonal specific juicy generously seasoned blackberry tobacco pepper huge presence palate finishes dried herb anise cellar
187656,206755,France,Burgundy,Domaine Perrot-Minot,Pinot Noir,93,minerally textured layers dark brooding character fruits considerable power richness intensity spice sweet almost soft
167317,136416,France,Loire Valley,Caves du Val de France,Sauvignon Blanc,85,tight herbaceous bright fruity offers grapefruit fresh lemon zest complexity pleasure
269057,38156,Germany,Rheinhessen,Wittmann,Riesling,91,fresh tangerine lemon aromas turn shade riper palate approachable elegant riesling luscious mouthfilling brightened tart lime grapefruit extends long
170903,140002,France,Burgundy,Domaine Chantal Lescure,Pinot Noir,92,parcel outside premier damodes structured steely mineral textured firm attractive perfumes potential jammy great smoky character wood aging
225227,244326,France,Burgundy,Albert Bichot,Pinot Noir,88,firm shows raspberry toast fine depth intense structure sweet
118648,187747,US,California,Hartford Court,Pinot Noir,92,southern part valley near sebastopol comes young juicy crisp pinot marked freshly crushed raspberries cherries enormously attractive accented toasty asian spices youthful acidic tightness suggests aging best decanting
218399,237498,Italy,Tuscany,San Luciano,Red Blend,87,masculine blend montepulciano cabernet sauvignon structure color sangiovese delicate aromas coffee leather tobacco sweet cherry woven within succulent meaty consistency
189783,208882,US,California,Tudal,Cabernet Sauvignon,94,fresh tannic full bodied offers deep blackberries cassis worth cellaring begin resolve
74054,93153,US,California,FlyWine,Chardonnay,86,offered travel size sourced russian river valley sonoma valley worthy companion pocket size important light citrus green apple oaky palate buttered toast enters fray
29268,279268,US,Oregon,Sineann,Pinot Noir,93,supersaturated dense decadent sweet jammy blackberry powerful intense ultraripe seems explode palate
8648,258648,US,Oregon,Sineann,Pinot Noir,96,sineann first reserve limited release vine blocks oregon greatest pinot vineyards fully biodynamic regular resonance ramps another notch ranges cherry prune acids perfect barrel concealed separate streaks cherry coffee smoke chocolate bourbon caramel—where stop goes goes phenomenal winemaking
