,id,country,province,winery,variety,points,description
150450,119549,Chile,Leyda Valley,Undurraga,Sauvignon Blanc,90,sniff receives immediate prickle fresh bell pepper offset citrus blossom passion components excellent sauvignon blanc appear carved sizzling tangerine orange grapefruit lime freshness physique purity sense place
7233,257233,US,California,Koehler,Pinot Noir,87,tart minty streak cutting cherry cola anise spice elegantly structured finesse delicacy fatter rounder now–
176897,145996,Italy,Sicily & Sardinia,Planeta,Chardonnay,91,smooth saturated chard beams strong sicilian sunshine within bouquet opens warm aromas yellow rose stone almond creamy vanilla mouth shows full pair shellfish white meat
240726,9825,US,Washington,Chateau Ste. Michelle,Chardonnay,89,climate cold creek vineyard sharpens contours chardonnay shows classic washington character bright apples peaches pears shot streaks butterscotch fermentation french malolactic retains crispness polished full bodied
144934,114033,US,California,Levendi,Chardonnay,90,salty brioche pretzel bread mind first entry aromatically palate intensity peach pineapple lush full bodied force accented vanilla
41775,60874,Chile,Central Valley,Corinto,Syrah,80,smells strange juniper berries blended tomato weedy fruits scratchy herbal mouth game oddball finishes gummy confected final blast green herbs weeds
75003,94102,US,California,Big Guy,Red Blend,88,shows super high score super drinkable steak pork veal chicken simple burger blended syrah cabernet sauvignon petit verdot merlot malbec great varieties sophisticated berry currant
128422,197521,US,New York,Castello di Borghese,Sauvignon Blanc,85,picked quite resulting features mainly melon aromas grassiness evidence crisp provides vivacity needed pair oysters clams
83126,152225,France,Burgundy,Chanson Père et Fils,Pinot Noir,93,dense serious layering tight surface firmness berry sumptuous great juicy freshness great bringing together structure roundness lively
239564,8663,Italy,Veneto,Novaia,Red Blend,88,savory selection offers spicy bouquet pepper nutmeg clove blackberry cherry refined vibrant palate cherry pepper spice framed silky refreshing
152609,121708,France,Burgundy,Louis Latour,Chardonnay,93,structured full tight texture shows creamy side wood integrated fruity mineral edge likely ready
182207,201306,US,California,Domaine Alfred,Syrah,89,califa winery highest designation kind reserve syrah oakier riper regular chamisal bottling fully marked high minty firm huge cherry courtesy hottest vintages edna valley history elegant intense ready
209490,228589,New Zealand,Central Otago,Craggy Range,Pinot Noir,89,soft mouthfilling rendition pinot noir cherry plum verge overripe marked mocha brown sugar slightly earthy
109208,178307,US,California,Cupcake,Pinot Noir,87,delicious pinot noir beside expensive bottlings stands silky raspberry cherry purée cola sweet vanilla sandalwood long spicy production cases
16645,266645,US,California,Woodbridge by Robert Mondavi,Chardonnay,87,chardonnay continues winery success bottling creamy pineapples pears vanilla spices
149778,118877,US,California,Matanzas Creek,Sauvignon Blanc,90,fine bone minerally sauvignon blanc enjoy shellfish grilled chicken appetizer touch adds richness vibrant acidic citrus lemongrass green apple
97060,166159,US,California,Gary Farrell,Chardonnay,86,bottling made experiment making white fermented skins seeds aged eight months french everyone cloudy funky teeming somewhat dense palate muted favor taste flowers clay
107960,177059,US,California,Domaine de la Terre Rouge,Syrah,94,super structured incredibly textured syrah sierra foothills bill easton best best aptly named ascent every showcase deft handling worthy syrah continue develop earthy dusty bacon cigar qualities truly beautiful bottle
136241,105340,US,New York,Heron Hill,Pinot Noir,90,gorgeous floral lift silky smooth cherry raspberry penetrating brisk invigorating mineral touch finely grained linger
243161,12260,US,California,Ridge,Zinfandel,92,vineyard blend includes petite sirah carignane mataro alicante bouschet meaty funky intense earthy barnyardy accents long tannic style holds barred full throttle aficionados
214249,233348,US,California,J. Lohr,Pinot Noir,87,almost sweet jammy filling cherries raspberries seasoning cinnamon brown sugar cocoa technically crispness fine arroyo seco
113460,182559,France,Burgundy,Albert Bichot,Chardonnay,93,fruity keeps flinty mineral nature fine chablis texture creamy wood peaches apricots cuts rounded like sharp knife giving shape preserving true freshness
76127,95226,France,Burgundy,L. Tramier & Fils,Chardonnay,84,soft gentle attractive citrus apple fruits offers crisp tangy aftertaste aging
107954,177053,US,Washington,Seven Hills,Cabernet Sauvignon,94,beautiful rendition pure cabernet sauvignon crafted oldest blocks iconic vineyard bracing youthful compact sends fascinating dusty spices fruits elegant barrel toast coconut butter beautiful balance length
215610,234709,US,California,Wilson,Zinfandel,84,high octane alcohol makes strong blackberry currant raisin tannic bitterness
233846,2945,US,New York,Glenora,Cabernet Sauvignon,84,readily likeable summer soup layered field greens texture lazy moderate almost tannin ribs sweet barbecue sauce
60873,79972,US,California,Bota Box,Zinfandel,83,jammy tart green mint white pepper alongside riper ones raspberries zinfandel burgers chill fridge
226934,246033,US,California,Roche,Pinot Noir,84,sharp gritty mouth cutting despite cherry spice sandalwood texture peppery tart
2257,252257,France,Burgundy,William Fèvre,Chardonnay,87,fèvre basic chablis shows quality producer finely textured fully layered strong citrus character toastiness adds complexity certainly dominate green plum lively
14310,264310,US,California,Merryvale,Merlot,84,carneros cool climate source merlot harvest exceedingly blackberry cherry tinged taste raisins hefty somewhat astringent
196964,216063,France,Burgundy,Bouchard Père & Fils,Pinot Noir,92,fine soft sweet berries surprisingly smooth heavyweight glorying opulence pinot noir brings
270772,39871,US,California,B.R. Cohn,Cabernet Sauvignon,84,mill tannic herbs berries fulfills basic requirements dryness full bodied balance
223854,242953,US,California,Merryvale,Cabernet Sauvignon,91,mint cedar tomato leaf accent lovely cassis full bodied slightly dusty mouthfeel like finely ground cinnamon cocoa picking finishes clean crisp soft
188272,207371,France,Bordeaux,Le Petit Cheval,Bordeaux-style Red Blend,92,barrel sample second cheval blanc surprisingly soft ripe—full blackberry fruits—with delicious lingering currant aftertaste
92666,161765,US,California,Avelina,Merlot,88,price merlot packs delicious punch offering soft persistent layers chocolate leather present managed smoke intermingle palate playing together
57310,76409,US,California,Baker & Brain,Syrah,94,violets blackberries espresso beans whirl together delicious silky josh baker matt brain similarly luxurious palate soft sensual boysenberry olallieberry shows peppery licorice spice boosted focused enlivens every part tongue
149568,118667,US,New York,Boundary Breaks,Riesling,91,waxy vein petroleum cuts enticingly juicy sweet pink grapefruit peach dainty semisweet riesling vivaciously spry finishes long lingering lacy veil sweetness
72897,91996,US,Washington,Camaraderie,Red Blend,85,winery every generic blend mixing vintages vineyards grapes forward powered relatively soft finishing astringent herbal
252370,21469,US,Oregon,Le Cadeau,Pinot Noir,92,subtle mingle mountain berries plums cherries enticing baking spices touch herb earth tanned leather bringing complexity texture lingering
1408,251408,US,Washington,Robert Karl,Merlot,86,light spicy made pale strawberry cranberry raspberry remain stiff peppery ripeness fill middle bottle
237867,6966,Italy,Veneto,Tenuta Casaletti,Red Blend,86,eventually shows earthy aromas grilled herb charcuterie ground clove aromas follow juicy rustic palate cherry funky game drinking loose somewhat fleeting
72699,91798,US,California,Bonneau,Chardonnay,83,oaky overwhelmed charry toast strong spicy wood people confuse taste chardonnay taste
158157,127256,US,Washington,Boomtown,Chardonnay,87,appealing aromas yellow apple pear spice lead deftly styled palate lightly creamy
252636,21735,US,California,Cable Car,Chardonnay,84,tasting lemonade lodi chardonnay veers sour uneven layers finishing toasty vanilla perfect casual togethers
173604,142703,US,California,Merry Edwards,Pinot Noir,91,pinot noirs kill depth winery basic vineyard designated pinot fantastic mellow delicious offers wave wave cherries currants cola pomegranates persimmons sweet thoroughly masterful blend seven vineyards now–
41428,60527,US,Oregon,Willamette Valley Vineyards,Pinot Noir,89,despite reserve designation tasting room light elegant style raspberry veneer sturdy herbal
259760,28859,Argentina,Mendoza Province,Don Rodolfo,Pinot Noir,86,cherry spice citrus peel aromas lead balanced palate tastes citrus raspberry spiced plum lightly buttered creamy sense carries mostly lively solid
38526,57625,Spain,Catalonia,Marco Abella,Red Blend,92,schisty aromas cherry spice reserved elevated bright juicy complexity baked berry fruits minerally core smooth mature steady lasting purity
222028,241127,US,California,Longboard,Cabernet Sauvignon,88,world famous rochioli cabernet grapes sell former winemaker oded shakked carefully crafts full bodied cabernet young acidic tannic polished core cherries ease decade
91291,160390,US,California,Siduri,Pinot Noir,92,winemakers fight coveted vineyard famously produces ageworthy pinots siduri vintage surprisingly versatile lovely raspberry cherry cocoa accented sweet balance impeccable fine soft refined certainly enjoy develop
227516,246615,Argentina,Mendoza Province,Hélène Garcin,Red Blend,93,winemakers hélène garcin patrice levêque coaxed character malbec cabernet vines result juicy dark asphalt aromas sitting front tight generous cassis blackberry finishing coffee mocha char leave happy
218178,237277,US,California,Failla,Pinot Noir,97,small production showcases wild feral lonely personality winery extreme coastal mountain location offering exotic hard describe asian pears pomegranates pepper cola currants licorice bacon rare berries like mulberries loganberries mind softly delicious drinkable firm acidic structure suggests aging future fascinating watch develop decade
277140,46239,US,California,Cru,Pinot Noir,86,super fruity direct pinot dimensional cherry raspberry mocha crisp silky texture
177095,146194,Italy,Central Italy,Casale del Giglio,Red Blend,90,best wines emerge lazio region italian capital innovative blend syrah petit verdot offers penetrating aromas leather espresso bean dark chocolate cherry pair rome favorite pasta dishes including spaghetti carbonara
201606,220705,US,California,Piña,Cabernet Sauvignon,94,shows richness power associated piña cabernet touch drier acidic winery offerings warmer parts napa blackberry cassis dark chocolate wrapped ample seriously wants least cellar
187988,207087,France,Bordeaux,Château Monbousquet,Bordeaux-style Red Blend,93,barrel sample grand classé sandy plain saint emilion monbousquet producing great wines thanks huge investments owner gerard perse merlot dominated blend spicy open
265287,34386,France,Bordeaux,Château Villa Bel Air,Bordeaux-style Red Blend,88,aging attractively structured juicy sweeter mature character herbs dryness appearing
217730,236829,France,Burgundy,Henri de Villamont,Chardonnay,92,winemaker pierre jehan interpretation corton charlemagne henri villamont retain great produce weight advantage spicy pear yellow fruits great bounce
10616,260616,US,California,Juslyn Vineyards,Cabernet Sauvignon,93,soft merlot franc largely beckstoffer tokalon vineyard dollop winery spring mountain estate complex young comes together harmoniously develop best hold beyond
277205,46304,New Zealand,Marlborough,Saint Clair,Pinot Noir,89,provocatively named bottling sourced lower waihopai valley section marlborough medium bodied supple places emphasis earthy beetroot clove adds cherry vanillin long savory spicy
189613,208712,US,California,Kenwood,Sauvignon Blanc,85,clean brisk sauvignon blanc pairing asian fare spicy overtly sweet lemongrass honey vanilla
4850,254850,US,California,Titus,Zinfandel,90,delicious succulent gigantic zinfandel impresses powerful ripeness blackberry plum cherry accented waves smoky wood cocoa asian spices strong long gradually losing density becoming softer sweeter
179919,149018,France,Southwest France,Producteurs Plaimont,Red Blend,91,earthy palate shows full bodied structure chewy fruits minerality textured offering spice blackberry plum skin
108879,177978,US,Washington,Soos Creek,Bordeaux-style Red Blend,92,blend cabernet sauvignon cabernet franc merlot pieces entirely pulled together winemaker david larsen builds wines long term everything proportion never jammy sleek steely veins iron mineral earth tight fruits influence minimal vineyard notable ageability wines
277177,46276,US,Washington,Acre Twenty-one,Cabernet Sauvignon,86,plum blue aromas entirely varietal offers plenty appeal lightly sweet squeeze
215974,235073,US,Washington,J. Bookwalter,Red Blend,93,winery seldom made reserve blend cabernet sauvignon cabernet franc syrah among stellar group bookwalter reds toughest decipher—at least first shows balance forward fruity start descent dark toasty barrel
213286,232385,Germany,Mosel,Dr. Pauly Bergweiler,Riesling,86,lemon zest exotic spices enliven crisp palate rounded cooked pear despite sweet attack riesling finishes chalky
274317,43416,Australia,Victoria,Fowles Wine,Riesling,89,comes thin granitic soils lean taut lime blossom green apple palate springtime feel crisp refreshing
249825,18924,US,California,LXV,Cabernet Sauvignon,89,though reserved first bottling begins dense blueberry coffee patience boisterous squeezed elderberry blackberry sipped beef char coffee dark chocolate purple flowers open shows potential
69824,88923,US,California,Small Wonders,Zinfandel,83,soft simple zinfandel sweet sugared raspberry currant sprinkled nutmeg cinnamon
40233,59332,Italy,Veneto,Allegrini,Red Blend,89,made blend corvina syrah oseleta savory made amarone leading producers offers currant bell pepper pepper tightly wound fresh pair grilled portobello mushrooms
56389,75488,France,Bordeaux,Château Lafleur-Gazin,Bordeaux-style Red Blend,87,smoky firm feel currant juiciness somewhere background dark tannic dense austere
262918,32017,US,California,Bjornstad,Chardonnay,94,dramatically bells whistles chardonnay made white burgundy style flamboyant pineapple nectarine guava lees influenced buttered toast cream vanilla crème brûlée acidic provides balance elegance fine
37560,56659,US,California,WesMar,Pinot Noir,91,vineyard designate opens intoxicating aromas violet rose expanding palate seamless sturdy waves juicy pomegranate cherry earthy somewhat feral ends
243663,12762,US,California,Eberle,Syrah,85,simple syrah decent cherry licorice tobacco quick clean certain elegance makes pairing wide variety fare
138853,107952,US,California,Ca' Momi,Chardonnay,86,offers fantastic array butterscotch orange pineapple peach vanilla bean brightened vital tastes lacks certain distinction
253415,22514,Germany,Baden,Salwey,Pinot Noir,94,exotic spice cedar mingle amidst plump cherries raspberries perfumed pinot noir firm form taut foundation crisp tart raspberry currant savory nuances dried herb crushed granite remarkably elegant squarely structured meld beautifully decade
23547,273547,US,California,Presidio,Merlot,87,cabernet franc east santa ynez valley best bordeaux reds appellation combine soft juicy berry herbal smooth
1821,251821,France,Burgundy,Bouchard Père & Fils,Pinot Noir,93,full concentrated impressive vintage offering solid structure powerful berry stone direct style complexities slow opens
93534,162633,US,Washington,Fall Line,Red Blend,88,kitchen sink style blend brings appealing cranberry plum dark flowers licorice elegant style soft minimal influence
177010,146109,US,California,Elyse,Syrah,85,lovely mouthfeel soft intricate blackberry cherry sweet though
215038,234137,US,California,Toad Hollow,Pinot Noir,85,dimensional otherwise everyday pinot noir varietal character silky texture clean cherries cola spices
104277,173376,US,California,Gary Farrell,Pinot Noir,93,currently austere impressive noble structure deep complex blackberries cranberries brown sugar spices depth long clearly cellar candidate opening least
117395,186494,Italy,Tuscany,Tenuta Argentiera,Red Blend,87,blend cabernet merlot syrah heat power locked within recognized slightly cooked jammy pleasant warm tones soft leather sweet pipe tobacco
258241,27340,Germany,Mosel,Von Schleinitz,Riesling,93,equal parts earth full bodied riesling offers loads penetrating melon citrus honey offset delicate tones saffron dusty mineral style struck exhilarating offers exceptional balance complexity
280050,49149,US,California,Redtree,Pinot Noir,84,price everyday pinot noir particularly complex shows silky texture firm dryness cherries
262128,31227,US,California,Cutruzzola,Pinot Noir,90,coming vineyards coastal town cambria paso robles brooding offers dark dank aromas dirt slate charred meat cherry sipped sagebrush lavender herbals emerge sour cherry promising effort area appellation
236007,5106,US,California,Communication Block,Red Blend,86,winery tell blend tastes vaguely rhônish velvety forward cherry mocha spice wrapped firm alcohol
207982,227081,Chile,Colchagua Valley,Santa Helena,Red Blend,90,aromatics dill vanilla straight world otherwise modern flush aromas cedar wood resin present front tannic roasted palate features soft berry cola medicinal sweet starts like rioja finishes like classic chilean cabernet includes merlot carmenère
279412,48511,US,California,Chimney Rock,Bordeaux-style Red Blend,92,austere elegant study power grace blending merlot cabernet sauvignon petit verdot cabernet franc substantial tannin defined brethren vintage shows cedar pencil shavings touch tobacco savory driven
238901,8000,US,California,Williams Selyem,Zinfandel,87,spicy williams selyem winemaker cabral memorable bacigalupi ever somewhat soft simple structure raspberry vanilla toast spice fine drinking
90508,159607,US,California,Drew,Pinot Noir,89,lively lean agile style fresh raspberry cranberry aromas tangy raspberry insistent firm frame light medium body soften broaden texture best
139458,108557,Germany,Rheingau,Prinz von Hessen,Riesling,89,thick overly sweet almost burnt edge caramelized sweet corn comes across chunky lacking length drop
243756,12855,Australia,South Australia,Penley Estate,Cabernet Sauvignon,91,really bold cassis aromas tinged tomato leaf vanilla waves cassis vanilla dried spices palate full bodied lushly textured long velvety feel best
169660,138759,Chile,Central Valley,Concha y Toro,Cabernet Sauvignon,86,aromas herbal fruits tobacco vanilla basic modest wiry acidic mouthfeel mixed herbs tomato cherry plum olive fresh racy tangy tomatoey
239618,8717,US,California,Merry Edwards,Pinot Noir,88,shows classic structure fine russian river pinot merry edwards making everything elegant crisp displays cherry pulp skin cola anise spice wrapped ultra refined velvety fruity focus concentration recent vintages though soon
175297,144396,US,California,Patz & Hall,Pinot Noir,88,full bodied heavy dramatic certainly thick raspberry touch milk chocolate high alcohol suggestive cherry liqueur chenoweth ranch signature
8572,258572,Chile,Aconcagua Valley,Porta,Cabernet Sauvignon,85,foxy jumpy first familiar aromas berry plum settle palate jammy tannic berries currants roasted tobacco olive present chewy weighty textured
41219,60318,US,Washington,Snoqualmie,Riesling,86,aromas clarity white flower orange rind struggling surface drinks medium sweet abundant floral orange peel provide appeal
269399,38498,US,Washington,Hawkins Cellars,Syrah,89,kiona vineyard mountain provides chandler reach yakima valley baking spice clove anise aromas followed light tart trail slightly toward spice filled
131390,100489,Australia,Australia Other,Woomera,Chardonnay,80,candy confectioner sugar open entry southeast australia watery palate almost nonexistent impression catchy name
199351,218450,US,California,Parkers Estate,Syrah,84,simple unfussy kind people quaff everyday world without analysis light bodied berries herbs tobacco
4631,254631,US,California,Roche,Merlot,83,simple merlot light bodied variety like pinot noir minty candied cherry lifesavers oaky toasted meringue
56202,75301,France,France Other,Patriarche Père et Fils,Chardonnay,84,soft rounded floral aromas citrusy light tang crisp aftertaste
130938,100037,US,Oregon,Archery Summit,Pinot Noir,90,fine elegant pinot noir infancy bright cranberry raspberry taking center stage shimmering vivid youthful vitality elevates juicy restrained influence though least expensive archery summit portfolio surprise cellar extra bottle bring unsuspected depth power
191410,210509,US,Washington,Pacific Rim,Riesling,93,release vineyard boosts alcohol dropping residual sugar deep concentrated driven dense minerality exceptional single vineyard riesling green apple white peach citrus rind sure evolve perhaps decades vivid penetrating improve significantly
253294,22393,US,California,Silenus,Cabernet Sauvignon,87,shows jammy raspberry cherry lacks structure flamboyant napa elegance lend appeal
104502,173601,US,California,Adelaida,Chardonnay,86,soft sweet balance like melted filling pineapple tart lemon meringue vanilla custard alcohol adds balancing burn
254874,23973,Germany,Rheingau,Baron Knyphausen,Riesling,94,dried orange rind saffron lend spicy exotic flair sweet silky honey marmalade beautifully concentrated riesling delicate frame intensely penetrating palate streaks orange bristling leaf astringency adds complexity
250889,19988,Germany,Rheinhessen,Gunderloch,Riesling,87,side medium bodied kabinett clocks alcohol seems balanced anyway peach pear aromas complexity smoke clover blossom mint crisp refreshing
214379,233478,Chile,Central Valley,San Elias,Cabernet Sauvignon,86,opening dried leaves spice berry authentic palate feel seems price structure cherry raspberry plum roasted mildly herbal proper feel follow
16564,266564,France,Loire Valley,Domaine Vacheron,Sauvignon Blanc,92,vacheron famed reds whites equal greater class dense rounded sunniest vineyards sancerre shows power richness fruits tropical white peach kiwi green plums yeast
57333,76432,France,Burgundy,Kirkland Signature,Chardonnay,90,made major chablis producer jean marc brocard soft attractively fruity crisp yellow fruits touch minerality comes blend different premier vineyards delicious refreshing ready
123541,192640,New Zealand,Marlborough,Freefall,Chardonnay,85,blend batches made neutral stainless steel obvious toast vanilla driven chardonnay apple pear citrus lead showing decent weight palate ending slightly short
231461,560,US,California,Limerick Lane,Syrah,93,name makes clear made head pruned older block unlikely syrah estate property seductive rare plum cherry leather pepper jump glass slowly purpose around core burly tannin intensely floral aromatics great
187164,206263,US,Washington,Dusted Valley,Syrah,92,ever popular stained tooth syrah hits high water mark dark smoky complex smorgasbord earthy brambly compote streaked vein vanilla dense compelling layers wild peppery herbal highlights extended
50479,69578,US,California,Ernest,Chardonnay,84,sticks giving caramelized richness dominates underlying moderate alcohol tastes feels overly manipulated
207270,226369,US,California,Joullian,Chardonnay,88,fine dryness cold minerality undergird tropical making particularly likeable food friendly showcases ability appellation middle salinas valley santa lucia highlands ripen white wines
35827,54926,US,California,Balletto,Pinot Noir,88,softly unfussy moderate rounded light bodied rose petal cherry aromas subtle supportive
153572,122671,France,Bordeaux,Château Thieuley,Merlot,89,southern slopes bordeaux entre deux mers rounded fleshy packed plum smoke vintage richness soft making already drinkable
103277,172376,Italy,Tuscany,Grattamacco,Red Blend,92,beautiful blend cabernet sauvignon cabernet franc petit verdot shows best bolgheri superiore winemaking opulence sophistication tones wild berry chocolate tobacco polished stone
76154,95253,Chile,Maule Valley,Sundance,Cabernet Sauvignon,82,weakly constituted cabernet opens raisiny aromas backed chunky palate raisin baked plum tastes baked feels rubbery
21170,271170,US,California,Freeman,Pinot Noir,89,manner spectacular vintage showing blast cherry filling raspberry tart cola smoky firm clean feels juvenile jamminess cellar resolve
38894,57993,France,Bordeaux,Château Malescasse,Bordeaux-style Red Blend,90,approaching maturity secondary animal aromas dried richness showing allowing shine warm vintage comes density dusty ready
228923,248022,Italy,Piedmont,La Fiammenga,Red Blend,88,passepied chunky displaying bright raspberry easygoing personality pleasant potential gracefully another five imported sapori italiani
117290,186389,Australia,South Australia,Marlargo,Red Blend,89,unlikely blend shiraz petit verdot hits bargain sipper boasting plenty weight interesting juxtaposition raspberry dark chocolate earthy provide depth surprisingly silky price range
117959,187058,Germany,Pfalz,Villa Wolf,Riesling,87,part loosen stable reasonably riesling reasonable price petrichor grapefruit lead riper citrus fruits helping round midpalate ends anise crushed stone citrus
213898,232997,US,Washington,Smasne Cellars,Syrah,88,promising site syrah lawrence vineyard designate delivers cherry pomegranate blackberry suggestions cola tart juicy fermented viognier livens
