,id,country,province,winery,variety,points,description
157611,126710,US,California,River Star,Cabernet Sauvignon,86,structure smooth made modern cult style soft immediate likeability blackberry cassis cherry appealing price demand depth complexity
74928,94027,US,New York,Merritt,Riesling,85,bracing forms backbone softened layers fresh apple pear overall austere touches pollen dried herb dust lend savory earthy tone lingers
126298,195397,US,California,Kenwood,Cabernet Sauvignon,84,string great vintages bottling disappointment four plus remains quite tannic acidic astringency
50445,69544,US,California,Oak Grove,Sauvignon Blanc,85,fresh citrusy lemon grapefruit aromas lead lightly herbal tastes almost medium bodied balance crispness straightforward character
15198,265198,France,Champagne,Larmandier-Bernier,Chardonnay,95,larmandier main vineyard vertus parcel grand vineyard cramant full beautifully beginning round ages green fruits white pears yeast dominant
95836,164935,US,New Mexico,Vivác Winery,Red Blend,85,core dark cherry raspberry scents smoky licorice spearmint subtleties medium body feels open pliant acids succulent
241627,10726,Austria,Kremstal,Nigl,Riesling,92,juicy luscious comice pears floral overtones brought tighter focus zesty freshness concentrated palate shows intensity warmth finishes long impression pure lemon
27180,277180,Chile,Curicó Valley,Aresti,Sauvignon Blanc,86,grapefruit lime aromas play melon stone fruits medium weight balanced together package shows nuttiness texture fairly full
154483,123582,US,California,Navarro,Pinot Noir,91,polished balanced masterpiece shows restraint already drinkable great fine intermingling spice appeal lovers gamay pinot noir
20561,270561,Italy,Northeastern Italy,Mezzacorona,Cabernet Sauvignon,87,grapes harvested north lake garda temperatures moderate produce lighter fresher style boasts intense forest berry greens clean smooth mouth
263082,32181,US,California,Cima Collina,Chardonnay,86,unique blend fermenting orange aging white flowers dried apples musky sandalwood palate simultaneously sour creamy tangerine banana
188919,208018,US,Oregon,White Rose,Pinot Noir,86,soft almost silky pale shows light cherry chocolate cola seep herb dried leaf
277068,46167,France,Alsace,Domaine Charles Frey,Riesling,94,wonderfully savory touch fragrant wild thyme precedes tangerine peel promising aromatically scented palate comes tangy zesty tangerine bright fresh lemon streamlined taut muscular svelte fills palate mind fizzing vibrant citrus shine absolutely concentrated palate refreshment excitement
54647,73746,US,Washington,Tildio,Riesling,88,residual sugar estate grown riesling carries definite sweetness tangy lime grapefruit citrus peel leesy textural focus citrus floral tails
184017,203116,US,California,Lorenzi Estate,Syrah,84,syrah starts earthy musky brawny escape wood oaked herbal greenness simply high alcohol
67664,86763,France,Burgundy,Albert Bichot,Pinot Noir,92,structure comes first dark concentrated spice core juicy layered dense together elements concentrated
106652,175751,US,Virginia,Barboursville Vineyards,Bordeaux-style Red Blend,90,octagon dark charred smelling aromas blackberry cocoa savory spice cherry palate tight finessed bearing vigorous manageable eventually fade reveal charming graphite fines herbes coffee grounds interest
85052,154151,Israel,Galilee,Golan Heights Winery,Cabernet Sauvignon,91,stunning balanced vineyard boasts blackberry cherry cassis aromas dusted accents cedar cocoa powder cigar spice round hedonistic mouth seductive dark mocha driven approachable stand cellar
190958,210057,US,California,Byron,Chardonnay,90,spicy oaky exudes honeyed quality pineapple lemon meringue brisk santa maria provides clean mouthwatering balance pair opulent chardonnay lobster shrimp salmon
197401,216500,US,California,Edna Valley Vineyard,Sauvignon Blanc,82,combination cool vintage cool region resulted unripe sauvignon blanc strong green pyrazines alongside lemons limes
114393,183492,US,Oregon,Sokol Blosser,Pinot Noir,90,forward immediately delicious peach pear apple expected fruits wild panoply balancing acids round forward full bodied textural uniquely flavorful distinctive laden profile
207856,226955,US,California,Chelsea Goldschmidt,Merlot,87,soft juicy merlot loaded cherry mocha smoky wrapped smooth finishes spicy
165045,134144,US,California,Lynmar,Chardonnay,90,myriad wonderful vineyards vibrant offers incredible deal price lively bouquet fennel apple pear chalky texture delicious baking spices popping balanced
95245,164344,US,Washington,Jones of Washington,Riesling,85,hailing newly approved ancient lakes appellation lime peach minerality frizzante drinking medium sweet tart lick
171169,140268,US,California,Loring Wine Company,Pinot Noir,95,brian loring bottling vineyard planted gary pisoni gary franscioni bursting raspberry syrup cola peppercorns palate boasts strawberry juice berries hibiscus luxurious sexy
51,250051,US,California,Cedar Knoll,Cabernet Sauvignon,83,funky start never blows turns soft simple mouth tamped blackberry okay anywhere
69651,88750,US,California,Monticello Vineyards,Chardonnay,85,exotic guava pineapple form profile tartness evolves intriguing layers dried herb lemongrass white slightly cooler section napa valley medium body length tight minerality
163984,133083,US,California,Écluse,Red Blend,91,deep hearty blend petit verdot merlot petite sirah syrah shows blueberry loamy soil violet milk chocolate lavish thick palate ever present evenly dispersed drive caramelized currant cocoa charred coffee
19628,269628,US,California,Shannon Ridge,Cabernet Sauvignon,85,heavy jammy like floods palate blackberries cherries currants anise chocolate full bodied texture
151924,121023,US,Washington,Stottle,Red Blend,88,unique blend tempranillo malbec mourvèdre leads aromas vanilla coconut woodspice followed blue dark restrained feel barrel brings enjoyment wood seems primary
39923,59022,US,California,Cru,Pinot Noir,91,light cherry marjoram allspice aromas mark bottling winery central valley sourced coastal regions interesting cherry enhanced leaf thyme peppercorns indian spices
227774,246873,US,California,Forth,Syrah,91,four plus interesting syrah best tight shut palate decanting help foods duck lamb cherry blackberry white pepper sweet leather blossom hold improve
9012,259012,US,Oregon,Adelsheim,Chardonnay,91,vineyard sites contribute juicy chardonnay luscious core apple melon lime mostly stainless steel fermented placed neutral barrels textural richness malolactic fermentation took place keeping acids fresh juicy
188567,207666,France,Burgundy,Pascal Bouchard,Chardonnay,92,honey wood aromas lead generally rounded aged wood white fruits full soft immediate pleasure complex undertow structure sweet malolactic character complex
183128,202227,US,Washington,Two Mountain,Bordeaux-style Red Blend,85,sturdy blend four bordeaux grapes tannic earthy structure sort rugged power look café ready juicy burger fries
167613,136712,France,Bordeaux,Château Lalande-Borie,Bordeaux-style Red Blend,92,dense great accompanying structure dark berry fruits full powerful great elegance stylish full complexity ready
57207,76306,US,California,Krutz,Chardonnay,92,elusively crisp inviting thickly intriguing floral orange blossom fresh apple structured lengthy retains tangy structured grapes sourced farmed vineyard
19897,269897,New Zealand,Marlborough,Terrace Heights Estate,Sauvignon Blanc,85,lightweight sauvignon built grassy side herbal overtones partially rounded modest passion peach midpalate despite citrusy finishes soft bracing imported zealand imports
171450,140549,US,California,Two Sisters,Pinot Noir,90,baked cherry cranberry kick bottling followed wild thyme touches dust smoke palate light zesty hibiscus cranberry fresh herbs
1083,251083,US,California,Calera,Pinot Noir,91,made forward style used calera jensen appeals lush raspberry cherry bacon vanilla sandalwood fine soft intricate lovely brief decant develop
133779,102878,US,Washington,Renegade,Bordeaux-style Red Blend,89,nothing wimpy bordeaux style blend except price delivers loading palate full bodied powered strawberry raspberry bolstered bracing balanced complete crisp
122784,191883,Italy,Central Italy,Fazi Battaglia,Red Blend,86,ekeos delivers thorny aromas forest berry distant herbal nuances clean compact texture sharp focused bright berry pair cheesy pasta dishes
11254,261254,South Africa,Franschhoek,Boekenhoutskloof,Cabernet Sauvignon,92,young vibrant dominates dense powerful shows elegance restraint punch currant dark plum coffee expect cellar least
190781,209880,US,Oregon,Amity Vineyards,Pinot Noir,87,soft pleasant widely available willamette valley bottling amity might pass simple bourgogne rouge cranberry watermelon fruits form basis feature light balanced clean gentle fade
257095,26194,US,California,Stephen & Walker,Zinfandel,89,soft complete balance denying delicious zinny floods mouth peppery spicy wild blackberries currants licorice beef jerky wrapped firm
82068,151167,France,Bordeaux,Château Malescot Saint-Exupery,Bordeaux-style Red Blend,91,barrel sample feels solid forming base juicy dark berry shows side dense
224299,243398,US,California,Cuvaison,Pinot Noir,87,napa side carneros comes full bodied pinot noir dark color cherry currant grenache like fully ready tasty steak
119409,188508,US,California,Zepaltas,Pinot Noir,87,tough gritty dominating acids hard mouthfeel impressive currant tangerine ruby grapefruit cola develop polish softness hard tell decant
162670,131769,US,Oregon,Native Flora,Pinot Noir,92,block selection hews closer conventional oregon pinots rest winery portfolio powerful focused cherry heart fermented native yeast spent months barrel deft touches graham cracker cocoa powder underscored cement minerality
266997,36096,US,California,Hawkstone,Cabernet Sauvignon,88,cabernet table dryness firm general balance shows deep long lasting currants anise smoky cedar develop bottle complexity
181797,200896,US,California,Harrington,Pinot Noir,83,pinot smells thin tastes thin tart accentuated generosity cherry cola score bottom scale
116040,185139,US,California,Super Sonoman,Chardonnay,84,winemaker aged months french resulting dominated product bears buttered toast butterscotch caramel green apple pear found basically swamped
16714,266714,France,Bordeaux,Château le Grand Paroissien,Bordeaux-style Red Blend,86,fruity packs blackberries leather herbs sweet remain firmly structured leaving fine fruits
238531,7630,US,California,Lasseter,Bordeaux-style Red Blend,87,merlot driven blend includes cabernet sauvignon cabernet franc malbec grapes grown upper bench blocks producer estate simple offering cherry currant cedar firm persistent round mouthfeel
150956,120055,US,Washington,Milbrandt,Merlot,89,full fruity round value priced merlot surprisingly lush style perfectly clean backed smooth cherry carries suggestion spices delicious wins
241124,10223,Spain,Catalonia,Paul Cheneau,Chardonnay,85,starts earthy toasty minerally aromas streak minty anise full bodied loaded earthy mushroomy like biting heaping handful mulch clean organized value
222056,241155,New Zealand,Waipara,Mount Cass,Chardonnay,88,quite attractive flinty aromas backed scents apple pear fleshy ripely tropical mouth giving impression richness without
276485,45584,US,Washington,Gramercy,Cabernet Sauvignon,95,winery first reserve level cabernet pure cabernet phinny hill bacchus vineyards offers heady aromas dried herbs currant cherry tobacco graphite tightly wound immediately accessible fleshing ramping intensity several days open shows impeccable tannin balance long life ahead best
33531,52630,US,California,Ojai,Pinot Noir,96,fine anything santa rita hills young tight future assured brilliant combination audacious classic structure blackberry currant cherry anise clove wrapped silky brightened crisp best decanting
168261,137360,Argentina,Mendoza Province,Mascota,Cabernet Sauvignon,87,inky aromas blueberry boysenberry collapsed reduced tannic grabby mouth tastes leathery plum salt saltiness carries onto tastes briny shows tannic grip
199424,218523,US,California,Tor Kenward,Chardonnay,88,tart citrusy offers streamlined lemons limes tannic herb minerals lees adding needed richness elegant chablisian trades fruity opulence complex connoisseur austerity chill
75322,94421,US,California,Talley,Chardonnay,88,shows distinctive edna valley pure laser like meyer lemon lime considerable aging adds richer cream yeast vibrant youthfulness
124422,193521,US,California,Murphy-Goode,Cabernet Sauvignon,83,heat vintage shows sugary jellied taste blackberries cherries fact almost porty
222071,241170,Germany,Mosel-Saar-Ruwer,Kendermanns,Riesling,88,slate selection kendermanns pleasant surprise speaking origins smoky slate aromas stony couched layers white peach melon honey despite considerable alcohol seems light fresh ending citrus melon imported kendermann gmbh weinkellerei
207934,227033,US,California,Chateau St. Jean,Cabernet Sauvignon,92,fans find balance previous vintages refuses bomb offers wealth sumptuous blackberry cherry liqueur pull back last moment blanket youthful long term ager hold find cases produced
181414,200513,New Zealand,Marlborough,Saint Clair,Pinot Noir,91,best crop saint clair pinots pioneer block boasts dark mysterious aromas damp earth plums full bodied creamy texture mocha emerging supple now–
7013,257013,US,Washington,Gifford Hirlinger,Merlot,86,limited case release merlot rest cabernet sauvignon significant influence barrels better sharpens edges adds tannic definition lightly toasty light pleasant
259198,28297,US,California,Hanna,Cabernet Sauvignon,86,tannic velvety mouthfeel blackberry cherry brown sugary edge like granola
93005,162104,US,Washington,Milbrandt,Bordeaux-style Red Blend,91,cabernet sauvignon makes majority merlot malbec petit verdot aromatically brooding toffee moist soil floral palate pulls punches high octane firm manages keep balance
118190,187289,Italy,Veneto,Masi,Red Blend,88,campofiorin undergoes double fermentation adds layers intensity richness aromas include chocolate spice cherry cola mouthfeel smooth dense packed tight velvety goodness
241579,10678,US,Washington,Maryhill,Merlot,84,herbal earthy tannic shows almost might best burger skirt steak absorb
202728,221827,US,California,Babcock,Cabernet Sauvignon,82,score higher showing green vegetal aromas asparagus find okay barely
154857,123956,Australia,South Australia,Jim Barry,Cabernet Sauvignon,93,released vintages barry luxury cuvée cabenet sauvignon plenty shows impressive baking spices vanilla brown sugar backs ample dark elegant despite size fine grained lingering now– possibly beyond
267425,36524,Uruguay,Canelones,Marichal,Red Blend,81,pinot noir blended tannat like unicorn uruguay smells cheesy murky linear palate padded tastes earthy like saucy plum tomato
68568,87667,Argentina,Mendoza Province,Kaiken,Cabernet Sauvignon,88,aromas ride high smoky pumped full scents chewy dense style cabernet thick rubbery baked blackberry resiny spice herbal long roasted lasting chewy
158337,127436,US,California,Bruliam,Pinot Noir,93,great success challenging vintage silky mouth marked brisk firm intricate cherry cola licorice feels really interesting changes every sniff develop
182274,201373,Argentina,Mendoza Province,Luigi Bosca,Cabernet Sauvignon,88,starts sort soft modest aromas mouth raspberry cherry quick lift grabby firm baby hits groove onto defined starchy feel long lasting cabernet essence airing best friend decant
78861,97960,US,California,J. Rickards,Zinfandel,88,estate vineyard impressive fruity plum cherry plush juiciness firm tannin structure aromas baked bread finishes vines full leather pepper
179491,148590,US,California,De Loach,Pinot Noir,96,vintage loach pinot noir game chilly vineyard south sebastopol among best ever crisp like squirt lime accompanies raspberry cherry persimmon bracing meanwhile mushroomy earthiness complex layers stop decade
205794,224893,US,California,Kendall-Jackson,Bordeaux-style Red Blend,96,filled berries stone fruits smoky grilled edge dramatic cabernet based bordeaux blend hails several great vineyards mainly stagecoach atlas peak drinks four plus showing lush beginning achieve bottle bouquet feels sweet soft mouth compelling complex nuanced great elegance allure
218102,237201,US,California,Albertina,Cabernet Sauvignon,83,smooth blackberry currant cedar herb marred excessive sharpness prohibit aging
149714,118813,France,Alsace,La Cave des Vignerons de Pfaffenheim,Riesling,92,breezy zingy lemon makes refreshing proposition palate disappoint continues tart citrus fashion sharp freshness palate makes citrus shine utterly refreshing totally moreish
61203,80302,US,California,Pianetta,Cabernet Sauvignon,88,light tart boysenberry anise wild mint chaparral scrub starts body lighter cabs pine cigar lead raspberry blackberry plum skins lively herbal characteristics decent lighter fare everyday quaffing
254628,23727,France,Burgundy,Louis Latour,Chardonnay,88,structure apples quince tight tense full mouth strong background concentration considerable freshness
232142,1241,US,Washington,Chateau Ste. Michelle,Chardonnay,88,solid widely distributed priced purpose chardonnay plenty buttery toast soft round fruit—lightly peachy—and unusual richness price range california style washington twist—real
224027,243126,Argentina,Mendoza Province,Bodega Catena Zapata,Chardonnay,87,chardonnay suffer something called barrel breath like bowl full lacquer heady melon palate sweet sweet sweet vanilla marshmallow resin typical melon citrus case less candy rate higher
223385,242484,US,California,Roche,Syrah,90,chilly roche carneros vineyard superripe syrahs shows array cherries berries peppery fine grilled charred beef bone complex pleasing drinking upscale fare
126685,195784,US,California,Geyser Peak,Sauvignon Blanc,88,vibrant bright green character suggesting limes lychee lemongrass drop viognier tiny percent softening enriching fine ceviche grilled veggies bruschetta topped melted goat cheese
255721,24820,US,Oregon,Megan Anne,Pinot Noir,93,best barrel blend spent months comprised nysa lachini vineyards featured vineyard designate bottlings project mark mcneilly mark ryan winery showing strongly moment baking spices galore suggesting gingerbread cookies dried cherries bottle soften built last
202178,221277,France,Burgundy,Domaine Faiveley,Pinot Noir,89,dark tannic dense core influences stalky plum skin flavored remain closed tight least open
145695,114794,US,Oregon,Belle Vallée,Pinot Noir,88,winery limited offering exotic aromas musk saffron sandalwood fills midpalate soft fruits floral highlights turns slightly soapy tannic
230308,249407,US,California,Cerro Prieto,Merlot,85,earthy blackberry tobacco cedar cherry chocolate edge firm round
187774,206873,Italy,Tuscany,Castello del Trebbio,Merlot,89,chewy expression merlot slightly jammy aromas blackberry maraschino cherry light shadings spice mineral appear background smooth soft
96157,165256,US,California,Flora Springs,Cabernet Sauvignon,93,estate elevated elevation opens fragrant cherry vanilla subtle trace brambly blackberry soft features supple mouthfeel medium weight backbone structure earthy enticing enjoyable added complexity
150627,119726,Chile,Maipo Valley,Santa Alicia,Red Blend,88,cedar graphite plum berry aromas bouquet feels fresh albeit choppy cassis berry fruits herbs together quick lacks complexity blend carmenère petit verdot shiraz
192604,211703,France,Bordeaux,Kirkland Signature,Bordeaux-style Red Blend,85,expressing structure vintage brings warmth blackberry fine texture firm upright feel ready drinking
52759,71858,France,Bordeaux,Goulée,Bordeaux-style Red Blend,90,barrel sample ninth harvest médoc bottling château estournel goulée coming vineyard matures palate concentrated chocolate currant fruits followed herbal
266052,35151,France,Burgundy,Vincent,Chardonnay,86,produced young vines château fuissé soft rounded sweet peach gentle ready
146512,115611,US,Oregon,St. Innocent,Chardonnay,92,dijon clone chardonnays oregon distinctive appealing excellent behind stays lean side tropical lightly buttery apple peach spicy kick
131592,100691,US,California,Eleven Eleven,Sauvignon Blanc,92,candied lemon tangerine grapefruit zest deliciously refreshing complex experience made bright palate accented tropical driven weighty feel
70685,89784,US,Oregon,David Hill,Pinot Noir,89,bright mountain berries bolstered steely firm lightly herbal sneaks clover improve another couple bottle
250714,19813,US,Oregon,Lazy River,Pinot Noir,83,whiff leather opens aging curve bitter edge rounded cherry cola
222533,241632,France,Burgundy,Domaine Moillard,Pinot Noir,93,dense tough submerged great fresh though shows balance certainly young least
116984,186083,US,Washington,Columbia Crest,Cabernet Sauvignon,89,scents tobacco enhance lush fruits amply demonstrate power washington grapes winemaking polished barrel aging adds vanilla smoke lower price value
116771,185870,US,New York,Red Newt Cellars,Riesling,89,evergreen herb accompany fresh apple lemon medium bodied palate brisk focused invigorating lime zest astringency
165265,134364,US,California,Wellington,Merlot,87,supple juicy blackberry plum light medium bodied merlot contains cabernet franc offers mouthful dusty finishing punch peppery spice
154757,123856,US,California,Castle Rock,Sauvignon Blanc,89,spectrum emphasizing grapefruit kiwi makes lively original assertive aromas grapefruit mown grass leap glass vivid tangy lingering crisp texture richness body complete package
90191,159290,Australia,South Australia,Wakefield Estate,Riesling,90,textbook clare valley riesling lime sherbet aromas across slightly dimensional young medium bodied slightly dusty texture especially notable long now–
258579,27678,US,California,Hesperian,Cabernet Sauvignon,86,almost color tannic four cabernet soft blackberry cassis dark chocolate despite made cabernet aging possibilities limited
218674,237773,US,Washington,Betz Family,Cabernet Sauvignon,96,taut muscular toasty young tight concentrated pure evocative earthy soil spice mineral complex betz blends vintage includes cabernet sauvignon—far away dominant fruits unfold panoply reds blues chewy polished complex showing exemplary back palate grip concentration
34157,53256,Italy,Piedmont,Ioppa,Red Blend,90,berry white pepper crushed herb balsamic lead elegant tense weight palate offers raspberry tart cherry anise clove framed taut polished bright
49049,68148,US,California,Justin,Red Blend,94,lush lavish ways blend syrah cabernet sauvignon petite sirah shows vanilla cream clove chiffon blueberry pudding palate packs blueberry pepper graphite espresso bean toasted sage framed solid structure tooth coating
9299,259299,US,California,B Side,Cabernet Sauvignon,85,flavorful intricate layers blackberries currants anise cedar entirely drawback sharpness form green acidic
121106,190205,France,Bordeaux,Château Citran,Bordeaux-style Red Blend,88,fresh firm seems typical fresh fruity
61135,80234,Spain,Northern Spain,Inurrieta,Sauvignon Blanc,86,passion citrus aromas straightforward sharp feels lemony tangy lean lemon lime mixed fresh green herbs scallion tarragon blend lingering lime
8021,258021,US,New York,Sherwood House Vineyards,Merlot,85,spicy sweet plums charred marry limited release sherwood house tobacco leaf green grass throughout soft supple dark smoky pleasant
194372,213471,US,California,Harmonique,Pinot Noir,89,soft pinot seems like coming useful life fully cherry berry cola spice starting turn mushroomy
250781,19880,France,Burgundy,Vincent Sauvestre,Pinot Noir,90,firm currant raspberry fruits dominate smooth underneath round pinot noir essential firmness
180425,149524,Canada,British Columbia,Quails' Gate,Chardonnay,88,half stainless half barrel soft supple boasts grapefruity acids lightly buttery pear flavored medium long fresh complex parting kiss cinnamon spice
101014,170113,France,Burgundy,Jean-Luc and Paul Aegerter,Pinot Noir,93,firm dense powerful dark concentrated character juicy plum damson fresh aftertaste delicious balance develops
223041,242140,US,California,Lolonis,Zinfandel,85,tastes cooked like oozes oven baked cherry raspberry chocolate fudge cassis exotic
79371,98470,Chile,Cachapoal Valley,Valle Secreto,Syrah,91,cherry plum aromas pure appealing peppery accents flush lush spiced plum oaky chocolate elegant focused valle secreto makes consistently syrah winery best date
27518,277518,Chile,Maipo Valley,De Martino,Red Blend,85,taut structured offering emphasizes cocoa coffee aromas complemented cedary underpinnings cherries currants keep things interesting
56970,76069,US,California,Priest Ranch,Bordeaux-style Red Blend,88,combines cabernet franc merlot cabernet sauvignon adding malbec petit verdot five bordeaux varietal blend coconut flakes vanilla hugged ride sticky quick offering huge ripeness
1665,251665,Chile,Colchagua Valley,Montes,Syrah,88,ruby pink color sweet aromas cotton candy cherry raspberry strawberry departure previous vintages cherub drier paler color wild textured full bodied rosés chile like rosés subtle less sweet
240621,9720,US,California,Roth,Sauvignon Blanc,90,tingling wraps around core pear peach integrated layered lush quiet entry midpalate picking power weight lovely choice table
187498,206597,France,Loire Valley,Domaine Laporte,Sauvignon Blanc,89,tropical character fixed firmly mineral context firm grapefruit character texture fresh rounds
11656,261656,France,Bordeaux,Château Valandraud,Bordeaux-style Red Blend,95,barrel sample powerful building freshness chocolate licorice powerful fruits structure potentially immense great
56682,75781,France,Burgundy,Jacques Bourguignon,Chardonnay,85,made buttery style vanilla toast flavored chablis tropical fruits dominate fruity palate touch minerality steeliness sight
